[
  {
    "id": "us-2026-honda-civic-lx",
    "market": "US", "make": "Honda", "model": "Civic Sedan", "year": 2026, "variant": "LX", "condition": "new", "bodyType": "sedan",
    "price": { "amount": 24695, "currency": "USD", "type": "starting", "validAt": "2026-08-18T00:00:00Z" },
    "capacity": { "seats": 5, "doors": 4, "bootLitres": null },
    "powertrain": { "fuelType": "petrol", "engineCc": null, "powerHp": 150, "torqueNm": null, "transmission": "cvt", "drivetrain": "fwd", "batteryKwh": null, "officialRangeKm": null },
    "dimensions": { "lengthMm": null, "widthMm": null, "heightMm": null, "wheelbaseMm": null, "groundClearanceMm": null },
    "efficiency": { "officialCombinedKmPerL": 15.3, "officialKwhPer100Km": null, "realWorldEstimate": null, "estimateUnit": null },
    "features": ["9-inch touchscreen", "wireless Apple CarPlay", "wireless Android Auto", "wireless phone charger"],
    "safetyFeatures": ["collision mitigation braking", "road departure mitigation"],
    "ownership": { "warrantyYears": null, "warrantyKm": null, "serviceIntervalKm": null, "partsAvailability": "unknown", "resaleOutlook": "unknown" },
    "suitabilityTags": ["first_time_buyer", "city_commute", "small_family", "fuel_efficient", "tight_parking"],
    "limitations": ["Lower rear-seat and cargo flexibility than a compact SUV", "FWD only on this trim"],
    "inventory": { "status": "unknown", "quantity": null, "showroomIds": [], "updatedAt": null },
    "provenance": { "verificationStatus": "partially_verified", "sources": [{ "url": "https://automobiles.honda.com/civic-sedan/specs-features-trim-comparison", "publisher": "American Honda Motor Co.", "sourceType": "manufacturer", "retrievedAt": "2026-08-18T00:00:00Z", "fields": ["price", "powertrain.powerHp", "powertrain.transmission", "powertrain.drivetrain", "efficiency", "features", "safetyFeatures"] }], "verifiedAt": "2026-08-18T00:00:00Z", "verifiedBy": "official-source-ingestion" }
  },
  {
    "id": "us-2026-toyota-camry-le",
    "market": "US", "make": "Toyota", "model": "Camry", "year": 2026, "variant": "LE", "condition": "new", "bodyType": "sedan",
    "price": { "amount": 29300, "currency": "USD", "type": "starting", "validAt": "2026-08-18T00:00:00Z" },
    "capacity": { "seats": 5, "doors": 4, "bootLitres": null },
    "powertrain": { "fuelType": "hybrid", "engineCc": 2500, "powerHp": null, "torqueNm": null, "transmission": "cvt", "drivetrain": "fwd", "batteryKwh": null, "officialRangeKm": null },
    "dimensions": { "lengthMm": null, "widthMm": null, "heightMm": null, "wheelbaseMm": null, "groundClearanceMm": null },
    "efficiency": { "officialCombinedKmPerL": 21.7, "officialKwhPer100Km": null, "realWorldEstimate": null, "estimateUnit": null },
    "features": ["8-inch multimedia touchscreen", "wireless Apple CarPlay", "wireless Android Auto", "dual-zone climate control"],
    "safetyFeatures": ["Toyota Safety Sense 3.0", "lane tracing assist", "dynamic radar cruise control"],
    "ownership": { "warrantyYears": null, "warrantyKm": null, "serviceIntervalKm": null, "partsAvailability": "unknown", "resaleOutlook": "unknown" },
    "suitabilityTags": ["family_sedan", "city_and_highway", "fuel_efficient", "long_commute", "comfort_priority"],
    "limitations": ["Sedan ride height and cargo opening are less versatile than an SUV", "AWD costs extra"],
    "inventory": { "status": "unknown", "quantity": null, "showroomIds": [], "updatedAt": null },
    "provenance": { "verificationStatus": "partially_verified", "sources": [{ "url": "https://www.toyota.com/camry/", "publisher": "Toyota Motor Sales, U.S.A.", "sourceType": "manufacturer", "retrievedAt": "2026-08-18T00:00:00Z", "fields": ["price", "powertrain", "efficiency", "features", "safetyFeatures"] }, { "url": "https://www.toyota.com/content/dam/toyota/brochures/pdf/2026/camry_ebrochure.pdf", "publisher": "Toyota Motor Sales, U.S.A.", "sourceType": "official_brochure", "retrievedAt": "2026-08-18T00:00:00Z", "fields": ["efficiency"] }], "verifiedAt": "2026-08-18T00:00:00Z", "verifiedBy": "official-source-ingestion" }
  },
  {
    "id": "us-2026-honda-cr-v-lx",
    "market": "US", "make": "Honda", "model": "CR-V", "year": 2026, "variant": "LX", "condition": "new", "bodyType": "suv",
    "price": { "amount": 30920, "currency": "USD", "type": "starting", "validAt": "2026-08-18T00:00:00Z" },
    "capacity": { "seats": 5, "doors": 4, "bootLitres": null },
    "powertrain": { "fuelType": "petrol", "engineCc": null, "powerHp": 190, "torqueNm": null, "transmission": "cvt", "drivetrain": "fwd", "batteryKwh": null, "officialRangeKm": null },
    "dimensions": { "lengthMm": null, "widthMm": null, "heightMm": null, "wheelbaseMm": null, "groundClearanceMm": null },
    "efficiency": { "officialCombinedKmPerL": null, "officialKwhPer100Km": null, "realWorldEstimate": null, "estimateUnit": null },
    "features": ["9-inch touchscreen", "wireless phone charger", "wireless Apple CarPlay", "60/40 split rear seat"],
    "safetyFeatures": ["collision mitigation braking", "road departure mitigation"],
    "ownership": { "warrantyYears": null, "warrantyKm": null, "serviceIntervalKm": null, "partsAvailability": "unknown", "resaleOutlook": "unknown" },
    "suitabilityTags": ["small_family", "compact_suv", "city_and_highway", "cargo_flexibility", "available_awd"],
    "limitations": ["Hybrid powertrain is not available on the LX trim", "AWD is optional, not standard"],
    "inventory": { "status": "unknown", "quantity": null, "showroomIds": [], "updatedAt": null },
    "provenance": { "verificationStatus": "partially_verified", "sources": [{ "url": "https://automobiles.honda.com/tools/build-and-price-trimwalk?fromvlp=1&modelseries=cr-v&modelyear=2026", "publisher": "American Honda Motor Co.", "sourceType": "manufacturer", "retrievedAt": "2026-08-18T00:00:00Z", "fields": ["price", "powertrain", "features", "safetyFeatures"] }], "verifiedAt": "2026-08-18T00:00:00Z", "verifiedBy": "official-source-ingestion" }
  },
  {
    "id": "us-2026-toyota-rav4-le",
    "market": "US", "make": "Toyota", "model": "RAV4", "year": 2026, "variant": "LE", "condition": "new", "bodyType": "suv",
    "price": { "amount": 31900, "currency": "USD", "type": "starting", "validAt": "2026-08-18T00:00:00Z" },
    "capacity": { "seats": 5, "doors": 4, "bootLitres": null },
    "powertrain": { "fuelType": "hybrid", "engineCc": null, "powerHp": null, "torqueNm": null, "transmission": "cvt", "drivetrain": "fwd", "batteryKwh": null, "officialRangeKm": null },
    "dimensions": { "lengthMm": null, "widthMm": null, "heightMm": null, "wheelbaseMm": null, "groundClearanceMm": null },
    "efficiency": { "officialCombinedKmPerL": 18.5, "officialKwhPer100Km": null, "realWorldEstimate": null, "estimateUnit": null },
    "features": ["12.3-inch digital gauge cluster", "10.5-inch multimedia system", "wireless Apple CarPlay", "wireless Android Auto"],
    "safetyFeatures": ["Toyota Safety Sense 4.0", "lane tracing assist", "dynamic radar cruise control"],
    "ownership": { "warrantyYears": null, "warrantyKm": null, "serviceIntervalKm": null, "partsAvailability": "unknown", "resaleOutlook": "unknown" },
    "suitabilityTags": ["small_family", "compact_suv", "city_and_highway", "fuel_efficient", "cargo_flexibility"],
    "limitations": ["Price excludes destination and dealer charges", "Dealer stock requires live confirmation"],
    "inventory": { "status": "unknown", "quantity": null, "showroomIds": [], "updatedAt": null },
    "provenance": { "verificationStatus": "partially_verified", "sources": [{ "url": "https://www.toyota.com/rav4/", "publisher": "Toyota Motor Sales, U.S.A.", "sourceType": "manufacturer", "retrievedAt": "2026-08-18T00:00:00Z", "fields": ["price", "powertrain.fuelType", "efficiency", "features", "safetyFeatures"] }], "verifiedAt": "2026-08-18T00:00:00Z", "verifiedBy": "official-source-ingestion" }
  },
  {
    "id": "us-2026-toyota-sienna-le",
    "market": "US", "make": "Toyota", "model": "Sienna", "year": 2026, "variant": "LE", "condition": "new", "bodyType": "mpv",
    "price": { "amount": 40820, "currency": "USD", "type": "starting", "validAt": "2026-08-18T00:00:00Z" },
    "capacity": { "seats": 8, "doors": 5, "bootLitres": null },
    "powertrain": { "fuelType": "hybrid", "engineCc": 2500, "powerHp": null, "torqueNm": null, "transmission": "cvt", "drivetrain": "fwd", "batteryKwh": null, "officialRangeKm": null },
    "dimensions": { "lengthMm": 5174, "widthMm": 1994, "heightMm": 1740, "wheelbaseMm": 3061, "groundClearanceMm": 162 },
    "efficiency": { "officialCombinedKmPerL": 15.3, "officialKwhPer100Km": null, "realWorldEstimate": null, "estimateUnit": null },
    "features": ["three-row seating", "sliding rear doors", "hybrid powertrain"],
    "safetyFeatures": ["Toyota Safety Sense 2.0", "full-speed range dynamic radar cruise control"],
    "ownership": { "warrantyYears": null, "warrantyKm": null, "serviceIntervalKm": null, "partsAvailability": "unknown", "resaleOutlook": "unknown" },
    "suitabilityTags": ["large_family", "three_rows", "elderly_access", "child_access", "road_trip", "fuel_efficient"],
    "limitations": ["Large exterior dimensions can be challenging in tight urban parking", "Ground clearance is lower than many SUVs"],
    "inventory": { "status": "unknown", "quantity": null, "showroomIds": [], "updatedAt": null },